{
  "schema_version": "1.0",
  "name": "inspect_gpu",
  "description": "Inspect GPU identity, utilization, temperature, VRAM, and optionally GPU processes.",
  "risk_level": 0,
  "timeout_seconds": 10,
  "idempotency": "read_only",
  "parameters": {
    "type": "object",
    "properties": {
      "include_processes": {
        "type": "boolean",
        "default": true
      }
    },
    "additionalProperties": false
  }
}
