{
  "schema_version": "1.0",
  "name": "run_tests",
  "description": "Run a registered workspace test profile with bounded output and timeout.",
  "risk_level": 1,
  "timeout_seconds": 3600,
  "idempotency": "required",
  "parameters": {
    "type": "object",
    "required": ["workspace_id", "profile_id", "idempotency_key"],
    "properties": {
      "workspace_id": {"type": "string", "minLength": 1},
      "profile_id": {"type": "string", "minLength": 1, "maxLength": 128},
      "timeout_seconds": {"type": "integer", "minimum": 1, "maximum": 3600},
      "idempotency_key": {"type": "string", "format": "uuid"}
    },
    "additionalProperties": false
  }
}
